{
  "$schema": "http://json-schema.org/draft-07/schema#",
  "title": "GitHub Project Template Schema",
  "type": "object",
  "required": ["project_template", "iteration", "fields", "columns", "views"],
  "properties": {
    "project_template": {
      "type": "string"
    },
    "iteration": {
      "type": "object",
      "required": ["name", "duration"],
      "properties": {
        "name": { "type": "string" },
        "duration": { "type": "integer", "minimum": 1 }
      }
    },
    "fields": {
      "type": "array",
      "items": {
        "type": "object",
        "required": ["name", "type"],
        "properties": {
          "name": { "type": "string" },
          "type": {
            "type": "string",
            "enum": ["single_select", "number", "text"]
          },
          "options": {
            "type": "array",
            "items": {
              "type": "object",
              "required": ["name", "description", "color"],
              "properties": {
                "name": { "type": "string" },
                "description": { "type": "string" },
                "color": { "type": "string" }
              }
            }
          }
        }
      }
    },
    "columns": {
      "type": "array",
      "items": { "type": "string" },
      "minItems": 1
    },
    "views": {
      "type": "array",
      "items": {
        "type": "object",
        "required": ["name", "fields"],
        "properties": {
          "name": { "type": "string" },
          "group_by": { "type": "string" },
          "sort_by": {
            "type": "array",
            "items": {
              "type": "object",
              "required": ["field", "direction"],
              "properties": {
                "field": { "type": "string" },
                "direction": { "type": "string", "enum": ["asc", "desc"] }
              }
            }
          },
          "filters": {
            "type": "array",
            "items": { "type": "string" }
          },
          "fields": {
            "type": "array",
            "items": { "type": "string" },
            "minItems": 1
          }
        }
      }
    }
  }
}
