{
  "$schema": "../schemas/project-schema.schema.json",
  "project_template": "SCRUM-DDSS-v1",
  "iteration": {
    "name": "Sprint",
    "duration": 14
  },
  "fields": [
    {
      "name": "Status",
      "type": "single_select",
      "options": [
        {
          "name": "üìã A Fazer",
          "description": "Item ainda n√£o iniciado",
          "color": "GRAY"
        },
        {
          "name": "üü¢ Pronto para iniciar",
          "description": "Item priorizado e pronto para execu√ß√£o",
          "color": "BLUE"
        },
        {
          "name": "üöß Em andamento",
          "description": "Item em desenvolvimento",
          "color": "YELLOW"
        },
        {
          "name": "üîç Em revis√£o",
          "description": "Item aguardando revis√£o",
          "color": "ORANGE"
        },
        {
          "name": "üì§ Aguardando valida√ß√£o",
          "description": "Item aguardando valida√ß√£o do PO",
          "color": "PINK"
        },
        {
          "name": "‚úÖ Conclu√≠do",
          "description": "Item finalizado e validado",
          "color": "GREEN"
        }
      ]
    },
    {
      "name": "Tipo de Item",
      "type": "single_select",
      "options": [
        {
          "name": "HU - Hist√≥ria de Usu√°rio",
          "description": "Requisito funcional descrito como HU",
          "color": "BLUE"
        },
        {
          "name": "DE - Defeito",
          "description": "Corre√ß√£o de erro ou falha",
          "color": "RED"
        },
        {
          "name": "ME - Melhoria",
          "description": "Aprimoramento em algo existente",
          "color": "YELLOW"
        },
        {
          "name": "TE - Requisito T√©cnico",
          "description": "Tarefa t√©cnica ou infraestrutura",
          "color": "GRAY"
        },
        {
          "name": "√âpico",
          "description": "Agregador de hist√≥rias relacionadas",
          "color": "PURPLE"
        }
      ]
    },
    {
      "name": "Prioridade",
      "type": "single_select",
      "options": [
        {
          "name": "üî• Urgente (P0)",
          "description": "Prioridade m√°xima",
          "color": "RED"
        },
        {
          "name": "‚è± Alta (P1)",
          "description": "Alta prioridade",
          "color": "ORANGE"
        },
        {
          "name": "üìå Normal (P2)",
          "description": "Prioridade padr√£o",
          "color": "BLUE"
        },
        {
          "name": "üßä Baixa (P3)",
          "description": "Baixa prioridade",
          "color": "GRAY"
        }
      ]
    },
    { "name": "PF Estimado", "type": "number" },
    { "name": "PF Validado", "type": "number" },
    { "name": "Crit√©rios de Aceita√ß√£o", "type": "text" },
    { "name": "Defini√ß√£o de Pronto", "type": "text" },
    {
      "name": "Valida√ß√£o do PO",
      "type": "single_select",
      "options": [
        {
          "name": "‚úÖ Validado",
          "description": "Aprovado pelo PO",
          "color": "GREEN"
        },
        {
          "name": "üïó Pendente",
          "description": "Aguardando valida√ß√£o",
          "color": "YELLOW"
        },
        {
          "name": "‚ùå Rejeitado",
          "description": "N√£o aprovado pelo PO",
          "color": "RED"
        }
      ]
    },
    { "name": "Evid√™ncia de Teste", "type": "text" },
    { "name": "Regra de Neg√≥cio", "type": "text" },
    { "name": "Depend√™ncias", "type": "text" },
    { "name": "Sprint (Issue ID)", "type": "text" }
  ],
  "columns": [
    "üìã Backlog do Produto",
    "üßæ Backlog da Sprint",
    "‚öôÔ∏è Em andamento",
    "üîç Em revis√£o",
    "üì§ Aguardando valida√ß√£o",
    "‚úÖ Feito"
  ],
  "views": [
    {
      "name": "üìÖ Sprint Atual",
      "group_by": "Status",
      "sort_by": [{ "field": "Sprint (Issue ID)", "direction": "asc" }],
      "filters": ["Sprint (Issue ID) = atual"],
      "fields": [
        "Tipo de Item",
        "PF Estimado",
        "Valida√ß√£o do PO",
        "Crit√©rios de Aceita√ß√£o"
      ]
    },
    {
      "name": "üìà M√©tricas de Entrega",
      "sort_by": [{ "field": "PF Validado", "direction": "desc" }],
      "filters": ["PF Validado != null"],
      "fields": ["Sprint (Issue ID)", "PF Estimado", "PF Validado", "Status"]
    },
    {
      "name": "üîç Itens Pendentes de Valida√ß√£o",
      "sort_by": [{ "field": "Status", "direction": "asc" }],
      "filters": ["Valida√ß√£o do PO = üïó Pendente"],
      "fields": ["Status", "Crit√©rios de Aceita√ß√£o", "Evid√™ncia de Teste"]
    },
    {
      "name": "üó∫Ô∏è Vis√£o por √âpico",
      "group_by": "Tipo de Item",
      "sort_by": [{ "field": "PF Estimado", "direction": "desc" }],
      "filters": ["Tipo de Item = √âpico"],
      "fields": ["Status", "PF Estimado"]
    }
  ]
}
